{
  "status": "error",
  "method_version": "gop-hgb-mae-v2",
  "phoneme_accuracy_summary": null,
  "words": [],
  "preprocessing": {
    "version": "handoff-16k-rms25-peak1-edge500-v1",
    "sample_rate": 16000,
    "duration_seconds": 1.0,
    "original_duration_seconds": 1.0,
    "leading_trim_seconds": 0.0,
    "trailing_trim_seconds": 0.0,
    "gain_db": 0.0,
    "already_preprocessed": true
  },
  "warnings": [],
  "error": {
    "code": "model_not_ready",
    "message": "Configure a real acoustic backend and a fitted GOP calibrator"
  }
}
