{
  "status": "ok",
  "method_version": "gop-hgb-mae-v2",
  "phoneme_accuracy_summary": 100.0,
  "words": [
    {
      "index": 0,
      "word": "WE",
      "phoneme_accuracy_summary": 100.0,
      "phones": [
        {
          "index": 0,
          "index_in_word": 0,
          "target": "W",
          "start_seconds": 0.58,
          "end_seconds": 0.72,
          "score": 100.0,
          "score_raw_0_2": 2.0,
          "needs_practice": false
        },
        {
          "index": 1,
          "index_in_word": 1,
          "target": "IY",
          "start_seconds": 0.72,
          "end_seconds": 0.9400000000000001,
          "score": 100.0,
          "score_raw_0_2": 2.0,
          "needs_practice": false
        }
      ]
    },
    {
      "index": 1,
      "word": "CALL",
      "phoneme_accuracy_summary": 100.0,
      "phones": [
        {
          "index": 2,
          "index_in_word": 0,
          "target": "K",
          "start_seconds": 0.9400000000000001,
          "end_seconds": 1.11,
          "score": 100.0,
          "score_raw_0_2": 2.0,
          "needs_practice": false
        },
        {
          "index": 3,
          "index_in_word": 1,
          "target": "AO",
          "start_seconds": 1.11,
          "end_seconds": 1.19,
          "score": 100.0,
          "score_raw_0_2": 2.0,
          "needs_practice": false
        },
        {
          "index": 4,
          "index_in_word": 2,
          "target": "L",
          "start_seconds": 1.19,
          "end_seconds": 1.22,
          "score": 100.0,
          "score_raw_0_2": 2.0,
          "needs_practice": false
        }
      ]
    },
    {
      "index": 2,
      "word": "IT",
      "phoneme_accuracy_summary": 100.0,
      "phones": [
        {
          "index": 5,
          "index_in_word": 0,
          "target": "IH",
          "start_seconds": 1.22,
          "end_seconds": 1.41,
          "score": 100.0,
          "score_raw_0_2": 2.0,
          "needs_practice": false
        },
        {
          "index": 6,
          "index_in_word": 1,
          "target": "T",
          "start_seconds": 1.41,
          "end_seconds": 1.47,
          "score": 100.0,
          "score_raw_0_2": 2.0,
          "needs_practice": false
        }
      ]
    },
    {
      "index": 3,
      "word": "BEAR",
      "phoneme_accuracy_summary": 100.0,
      "phones": [
        {
          "index": 7,
          "index_in_word": 0,
          "target": "B",
          "start_seconds": 1.62,
          "end_seconds": 1.67,
          "score": 100.0,
          "score_raw_0_2": 2.0,
          "needs_practice": false
        },
        {
          "index": 8,
          "index_in_word": 1,
          "target": "EH",
          "start_seconds": 1.67,
          "end_seconds": 1.8,
          "score": 100.0,
          "score_raw_0_2": 2.0,
          "needs_practice": false
        },
        {
          "index": 9,
          "index_in_word": 2,
          "target": "R",
          "start_seconds": 1.8,
          "end_seconds": 1.99,
          "score": 100.0,
          "score_raw_0_2": 2.0,
          "needs_practice": false
        }
      ]
    }
  ],
  "preprocessing": {
    "version": "kevin-16k-rms25-peak1-edge500-v1",
    "sample_rate": 16000,
    "duration_seconds": 2.58,
    "original_duration_seconds": 2.58,
    "leading_trim_seconds": 0.0,
    "trailing_trim_seconds": 0.0,
    "gain_db": 0.0,
    "already_preprocessed": true
  },
  "warnings": [
    "independent_utterance_ivector_state",
    "mfcc_dither_disabled_for_reproducibility",
    "forced_alignment_does_not_prove_phone_was_spoken"
  ],
  "error": null
}
