{
  "status": "ok",
  "method_version": "gop-hgb-mae-v2",
  "phoneme_accuracy_summary": 80.0,
  "words": [
    {
      "index": 0,
      "word": "TEST",
      "phoneme_accuracy_summary": 80.0,
      "phones": [
        {
          "index": 0,
          "index_in_word": 0,
          "target": "T",
          "start_seconds": 0.0,
          "end_seconds": 0.1,
          "score": 80.0,
          "score_raw_0_2": 1.6,
          "needs_practice": true
        },
        {
          "index": 1,
          "index_in_word": 1,
          "target": "EH",
          "start_seconds": 0.1,
          "end_seconds": 0.2,
          "score": 80.0,
          "score_raw_0_2": 1.6,
          "needs_practice": true
        },
        {
          "index": 2,
          "index_in_word": 2,
          "target": "S",
          "start_seconds": 0.2,
          "end_seconds": 0.30000000000000004,
          "score": 80.0,
          "score_raw_0_2": 1.6,
          "needs_practice": true
        },
        {
          "index": 3,
          "index_in_word": 3,
          "target": "T",
          "start_seconds": 0.30000000000000004,
          "end_seconds": 0.4,
          "score": 80.0,
          "score_raw_0_2": 1.6,
          "needs_practice": true
        }
      ]
    }
  ],
  "preprocessing": {
    "version": "kevin-16k-rms25-peak1-edge500-v1",
    "sample_rate": 16000,
    "duration_seconds": 1.0,
    "original_duration_seconds": 1.0,
    "leading_trim_seconds": 0.0,
    "trailing_trim_seconds": 0.0,
    "gain_db": -1.9896701815146045,
    "already_preprocessed": false
  },
  "warnings": [
    "synthetic_integration_fixture_not_speech_assessment"
  ],
  "error": null
}
